{
  "$id": "bureau_generation_plan_v1.schema.json", "$schema": "https://json-schema.org/draft/2020-12/schema",
  "type": "object", "additionalProperties": false,
  "required": ["schema_version", "artifact_type", "artifact_id", "property_id", "episode_id", "created_at", "generator_version", "upstream_artifacts", "validation_status", "source_episode_id", "aspect_ratio", "cost_ceiling_cents", "attempt_ceiling_per_asset", "capability_requirements", "shot_requests"],
  "properties": {
    "schema_version": {"$ref": "common_defs_v1.schema.json#/$defs/schema_version"}, "artifact_type": {"const": "bureau_generation_plan_v1"}, "artifact_id": {"$ref": "common_defs_v1.schema.json#/$defs/artifact_id"}, "property_id": {"$ref": "common_defs_v1.schema.json#/$defs/property_id"}, "episode_id": {"$ref": "common_defs_v1.schema.json#/$defs/episode_id"}, "created_at": {"$ref": "common_defs_v1.schema.json#/$defs/created_at"}, "generator_version": {"$ref": "common_defs_v1.schema.json#/$defs/generator_version"}, "upstream_artifacts": {"$ref": "common_defs_v1.schema.json#/$defs/upstream_artifacts"},
    "validation_status": {"const": "validated"}, "source_episode_id": {"$ref": "common_defs_v1.schema.json#/$defs/episode_id"}, "aspect_ratio": {"enum": ["9:16", "1:1", "4:5", "16:9"]}, "cost_ceiling_cents": {"type": "integer", "minimum": 0, "maximum": 100000}, "attempt_ceiling_per_asset": {"type": "integer", "minimum": 1, "maximum": 5}, "capability_requirements": {"$ref": "common_defs_v1.schema.json#/$defs/tag_list"},
    "shot_requests": {"type": "array", "minItems": 7, "maxItems": 11, "items": {"type": "object", "additionalProperties": false, "required": ["shot_id", "asset_type", "aspect_ratio", "duration_ms", "prompt_components", "negative_constraints", "image_dependencies", "video_dependencies", "audio_dependencies", "continuity_anchors", "motion_contract", "output_requirements", "qa_requirements"], "properties": {"shot_id": {"type": "string", "pattern": "^shot_[0-9]{2}$"}, "asset_type": {"enum": ["still_image", "motion_clip", "instructional_graphic", "hybrid_clip"]}, "aspect_ratio": {"enum": ["9:16", "1:1", "4:5", "16:9"]}, "duration_ms": {"type": "integer", "minimum": 2000, "maximum": 10000}, "prompt_components": {"type": "object", "additionalProperties": false, "required": ["environment", "subject", "action", "camera", "lighting", "materials", "palette"], "properties": {"environment": {"$ref": "common_defs_v1.schema.json#/$defs/nonempty_string"}, "subject": {"$ref": "common_defs_v1.schema.json#/$defs/nonempty_string"}, "action": {"$ref": "common_defs_v1.schema.json#/$defs/nonempty_string"}, "camera": {"$ref": "common_defs_v1.schema.json#/$defs/nonempty_string"}, "lighting": {"$ref": "common_defs_v1.schema.json#/$defs/nonempty_string"}, "materials": {"$ref": "common_defs_v1.schema.json#/$defs/string_list"}, "palette": {"$ref": "common_defs_v1.schema.json#/$defs/string_list"}}}, "negative_constraints": {"$ref": "common_defs_v1.schema.json#/$defs/string_list"}, "image_dependencies": {"type": "array", "items": {"$ref": "common_defs_v1.schema.json#/$defs/slug"}, "maxItems": 20}, "video_dependencies": {"type": "array", "items": {"$ref": "common_defs_v1.schema.json#/$defs/slug"}, "maxItems": 20}, "audio_dependencies": {"type": "array", "items": {"$ref": "common_defs_v1.schema.json#/$defs/slug"}, "maxItems": 20}, "continuity_anchors": {"$ref": "common_defs_v1.schema.json#/$defs/tag_list"}, "motion_contract": {"type": "object", "additionalProperties": false, "required": ["subject_motion", "camera_motion", "temporal_behavior"], "properties": {"subject_motion": {"$ref": "common_defs_v1.schema.json#/$defs/nonempty_string"}, "camera_motion": {"$ref": "common_defs_v1.schema.json#/$defs/nonempty_string"}, "temporal_behavior": {"$ref": "common_defs_v1.schema.json#/$defs/nonempty_string"}}}, "output_requirements": {"$ref": "common_defs_v1.schema.json#/$defs/string_list"}, "qa_requirements": {"$ref": "common_defs_v1.schema.json#/$defs/string_list"}}}}
  }
}
