{
  "artifact_id": "itb_ep_001_generation_plan_v1",
  "artifact_type": "bureau_generation_plan_v1",
  "aspect_ratio": "9:16",
  "attempt_ceiling_per_asset": 1,
  "capability_requirements": [
    "deterministic_seed_support",
    "portrait_aspect_ratio",
    "shot_duration_control",
    "source_lineage_receipt"
  ],
  "cost_ceiling_cents": 0,
  "created_at": "2026-08-02T00:12:00Z",
  "episode_id": "itb_ep_001",
  "generator_version": "itb_deterministic_compiler_v1",
  "property_id": "interstitial_travel_bureau",
  "schema_version": "itb_artifact_v1",
  "shot_requests": [
    {
      "aspect_ratio": "9:16",
      "asset_type": "motion_clip",
      "audio_dependencies": [
        "narration_01"
      ],
      "continuity_anchors": [
        "amber_eye_catchlight",
        "mercury_edge_rim",
        "one_beat_early",
        "correct_mirror_geometry"
      ],
      "duration_ms": 5000,
      "image_dependencies": [],
      "motion_contract": {
        "camera_motion": "locked_symmetrical_push",
        "subject_motion": "Traveler coat settles naturally; reflected shoulders settle 500 milliseconds early; mercury rim climbs against gravity.",
        "temporal_behavior": "Hard optical splice on the reflection's completed blink."
      },
      "negative_constraints": [
        "No horror face distortion.",
        "No incorrect left-right mirror geometry.",
        "No extra people or duplicate bodies outside glass."
      ],
      "output_requirements": [
        "clean_master",
        "preserve_source_lineage",
        "no_embedded_credentials"
      ],
      "prompt_components": {
        "action": "The reflection finishes one blink before the traveler stops at the yellow inspection line.",
        "camera": "locked_symmetrical_push; Vertical medium-wide with traveler centered low and waiting reflection centered high inside the panel.; Slow five-percent optical push with straight architectural lines and no digital warp.",
        "environment": "mirror_customs_hall",
        "lighting": "Overhead cream fluorescents; amber CRT catchlights appear only in reflected eyes.",
        "materials": [
          "smoked_glass",
          "chronometric_silver",
          "wool_coat",
          "teal_tile"
        ],
        "palette": [
          "oxidized_teal",
          "amber_phosphor",
          "mercury_silver",
          "cream_fluorescent"
        ],
        "subject": "A standing traveler seen from behind and the same reflection already facing camera inside smoked glass."
      },
      "qa_requirements": [
        "semantic_visual_review",
        "entity_continuity",
        "shot_role_fidelity",
        "caption_safe_composition"
      ],
      "shot_id": "shot_01",
      "video_dependencies": []
    },
    {
      "aspect_ratio": "9:16",
      "asset_type": "motion_clip",
      "audio_dependencies": [
        "narration_02"
      ],
      "continuity_anchors": [
        "mercury_edge_rim",
        "correct_mirror_geometry",
        "one_beat_early"
      ],
      "duration_ms": 5000,
      "image_dependencies": [],
      "motion_contract": {
        "camera_motion": "high_corner_observation",
        "subject_motion": "Rubber walkway moves toward camera; reflected walkway remains fixed; condensation travels upward.",
        "temporal_behavior": "Iris down into a Bureau diagram circle."
      },
      "negative_constraints": [
        "No curving funhouse mirror.",
        "No neon cyberpunk city.",
        "No spatially incoherent architecture."
      ],
      "output_requirements": [
        "clean_master",
        "preserve_source_lineage",
        "no_embedded_credentials"
      ],
      "prompt_components": {
        "action": "Amber counter 001 advances while one teal floor tile telescopes out of the physical corridor.",
        "camera": "high_corner_observation; Extreme vertical wide showing traveler as a small figure beneath nine mirror panels.; Deep-focus 24-millimeter geometry with reflected vanishing point impossibly distant but structurally straight.",
        "environment": "arrival_walkway",
        "lighting": "Cream ceiling baffles alternate with amber pools; mirror depth falls into cyan haze.",
        "materials": [
          "ribbed_rubber",
          "brushed_aluminum",
          "smoked_glass",
          "acoustic_fiber"
        ],
        "palette": [
          "teal_tile",
          "amber_counter",
          "cyan_depth",
          "cream_baffle"
        ],
        "subject": "The physical twelve-meter Annex and its reflection extending as a kilometer-long terminal."
      },
      "qa_requirements": [
        "semantic_visual_review",
        "entity_continuity",
        "shot_role_fidelity",
        "caption_safe_composition"
      ],
      "shot_id": "shot_02",
      "video_dependencies": []
    },
    {
      "aspect_ratio": "9:16",
      "asset_type": "instructional_graphic",
      "audio_dependencies": [
        "narration_03"
      ],
      "continuity_anchors": [
        "one_beat_early",
        "correct_mirror_geometry",
        "amber_eye_catchlight"
      ],
      "duration_ms": 5500,
      "image_dependencies": [],
      "motion_contract": {
        "camera_motion": "orthographic_instructional",
        "subject_motion": "Mechanical vector arrows step in four discrete optical-printer increments.",
        "temporal_behavior": "Diagram's teal cone becomes the floor's yellow inspection wedge."
      },
      "negative_constraints": [
        "No unreadable pseudo-text.",
        "No three-dimensional perspective.",
        "No arbitrary glitch effects."
      ],
      "output_requirements": [
        "clean_master",
        "preserve_source_lineage",
        "no_embedded_credentials"
      ],
      "prompt_components": {
        "action": "The amber reflected cursor advances 500 milliseconds ahead, borrows one DECISION token, then stops.",
        "camera": "orthographic_instructional; Flat full-frame diagram with captions protected in the middle sixty percent.; No perspective; slight gate weave limited to two pixels.",
        "environment": "bureau_optical_diagram",
        "lighting": "Even cel illumination with amber phosphor bloom around the early cursor.",
        "materials": [
          "painted_cel",
          "graphite_label",
          "crt_phosphor",
          "optical_film"
        ],
        "palette": [
          "bureau_cream",
          "oxidized_teal",
          "warning_amber",
          "graphite_black"
        ],
        "subject": "Cream field diagram of traveler, mirror plane, ninety-degree viewing cone, and a second amber timeline cursor."
      },
      "qa_requirements": [
        "semantic_visual_review",
        "entity_continuity",
        "shot_role_fidelity",
        "caption_safe_composition"
      ],
      "shot_id": "shot_03",
      "video_dependencies": []
    },
    {
      "aspect_ratio": "9:16",
      "asset_type": "hybrid_clip",
      "audio_dependencies": [
        "narration_04"
      ],
      "continuity_anchors": [
        "mercury_edge_rim",
        "one_beat_early",
        "correct_mirror_geometry"
      ],
      "duration_ms": 5000,
      "image_dependencies": [],
      "motion_contract": {
        "camera_motion": "archival_tripod",
        "subject_motion": "Hand-cranked footage jitters at eighteen frames per second while stamp animation remains perfectly steady.",
        "temporal_behavior": "Stamped diagonal becomes the traveler's sideways path arrow."
      },
      "negative_constraints": [
        "No gore or panic.",
        "No modern clothing logos.",
        "No imitation of a known film or television property."
      ],
      "output_requirements": [
        "clean_master",
        "preserve_source_lineage",
        "no_embedded_credentials"
      ],
      "prompt_components": {
        "action": "A gloved clerk stamps ACKNOWLEDGED across the frame before the traveler's hand reaches shoulder height.",
        "camera": "archival_tripod; Square archival insert within a rounded CRT bezel and teal inspection labels.; Slight edge softness, halation on white gloves, stable human proportions.",
        "environment": "archive_screening_room",
        "lighting": "Flat institutional tungsten with silver flare confined to mirror edges.",
        "materials": [
          "silver_gelatin_film",
          "ribbed_crt_glass",
          "salmon_stamp_ink",
          "white_cotton_glove"
        ],
        "palette": [
          "faded_salmon",
          "teal_label",
          "tungsten_cream",
          "silver_flare"
        ],
        "subject": "Grainy Bureau training footage of a 1960s traveler waving toward an already-seated reflection."
      },
      "qa_requirements": [
        "semantic_visual_review",
        "entity_continuity",
        "shot_role_fidelity",
        "caption_safe_composition"
      ],
      "shot_id": "shot_04",
      "video_dependencies": []
    },
    {
      "aspect_ratio": "9:16",
      "asset_type": "motion_clip",
      "audio_dependencies": [
        "narration_05"
      ],
      "continuity_anchors": [
        "amber_eye_catchlight",
        "mercury_edge_rim",
        "correct_mirror_geometry"
      ],
      "duration_ms": 5500,
      "image_dependencies": [],
      "motion_contract": {
        "camera_motion": "macro_profile_track",
        "subject_motion": "One deliberate lateral head movement; condensation beads climb across glass in the opposite direction.",
        "temporal_behavior": "Three circular catchlights become three numbered blink-verifier lenses."
      },
      "negative_constraints": [
        "No eye deformation.",
        "No beauty-commercial lighting.",
        "No contact between skin and glass."
      ],
      "output_requirements": [
        "clean_master",
        "preserve_source_lineage",
        "no_embedded_credentials"
      ],
      "prompt_components": {
        "action": "The physical pupil exits frame; the reflected pupil tracks once, then freezes.",